2012-03-08 18:22:55.103204 IP 10.0.2.15.32959 > 74.125.230.242.80: Flags [P.], seq 884395512:884396126, ack 1162056706, win 14600, length 614
2012-03-08 18:22:55.166568 IP 74.125.230.242.80 > 10.0.2.15.32959: Flags [P.], seq 1:1419, ack 614, win 65535, length 1418
2012-03-08 18:22:55.172394 IP 74.125.230.242.80 > 10.0.2.15.32959: Flags [P.], seq 1419:2837, ack 614, win 65535, length 1418
2012-03-08 18:22:55.175252 IP 74.125.230.242.80 > 10.0.2.15.32959: Flags [P.], seq 2837:3700, ack 614, win 65535, length 863
2012-03-08 18:22:55.175306 IP 74.125.230.242.80 > 10.0.2.15.32959: Flags [P.], seq 3700:5118, ack 614, win 65535, length 1418
2012-03-08 18:22:55.175313 IP 74.125.230.242.80 > 10.0.2.15.32959: Flags [P.], seq 5118:6536, ack 614, win 65535, length 1418
2012-03-08 18:22:55.175315 IP 74.125.230.242.80 > 10.0.2.15.32959: Flags [P.], seq 6536:7796, ack 614, win 65535, length 1260
2012-03-08 18:22:55.175315 IP 74.125.230.242.80 > 10.0.2.15.32959: Flags [P.], seq 7796:9214, ack 614, win 65535, length 1418
2012-03-08 18:22:55.175316 IP 74.125.230.242.80 > 10.0.2.15.32959: Flags [P.], seq 9214:10632, ack 614, win 65535, length 1418
2012-03-08 18:22:55.175316 IP 74.125.230.242.80 > 10.0.2.15.32959: Flags [P.], seq 10632:11892, ack 614, win 65535, length 1260
